[
  {
    "id": "example-1",
    "parentId": null,
    "spouseId": "example-2",
    "familyName": "张家",
    "generation": 3,
    "name": "张三",
    "nickName": "小张",
    "relation": "我自己",
    "birthYear": 1995,
    "gender": "male",
    "birthdayType": "solar",
    "birthMonth": 8,
    "birthDay": 30
  },
  {
    "id": "example-2",
    "parentId": null,
    "spouseId": "example-1",
    "familyName": "李家",
    "generation": 3,
    "name": "李四",
    "relation": "老婆",
    "birthYear": 1996,
    "gender": "female",
    "birthdayType": "lunar",
    "birthMonth": 5,
    "birthDay": 12
  }
]
